{"answerability":"resident","deadline":"2026-08-29T13:00:00Z","gate_id":"gate-1","kind":"harness.ask_user","opened_event_id":"event-6","opened_journal_seq":6,"prompt":{"body":"Choose a public option.","controls":[{"action":"approve","label":"Approve"},{"action":"cancel","label":"Cancel"}],"origin":"https://example.test","render_hint":{"compact":true},"schema":{"fields":[{"default":true,"kind":"confirm","label":"Continue?","name":"confirm","required":true}]},"title":"Continue?"}}
